Posição;Nome;Estado;"Pública ou Privada";"Posição em avaliação do Mercado";"Nota em avaliação do Mercado";"Posição em qualidade de ensino";"Nota em qualidade de ensino";"Posição em Instrução dos Professores";"Nota em Instrução dos Professores";"Posição Nota dos concluintes";"Nota dos concluintes";"Posição em Tempo de Dedicação dos Professores";"Nota em Tempo de Dedicação dos Professores";"Posição no MEC";"Nota no MEC"
1;"Universidade de São Paulo (USP)";SP;Pública;1;36;2;59.96;2;7.96;;;1;8;1;44
2;"Universidade Federal de Viçosa (UFV)";MG;Pública;3;34;1;61.37;17;7.39;5;3.89;1;8;2;42.09
3;"Universidade Federal de Lavras (UFLA)";MG;Pública;4;33;3;59.01;5;7.85;38;2.99;1;8;3;40.17
4;"Universidade Estadual Paulista Júlio de Mesquita Filho (UNESP)";SP;Pública;1;36;6;55;3;7.92;37;3.02;108;3.89;3;40.17
5;"Universidade Federal do Rio Grande do Sul (UFRGS)";RS;Pública;6;31;4;55.75;8;7.73;13;3.67;1;8;5;36.35
6;"Universidade Federal de Santa Maria (UFSM)";RS;Pública;6;31;5;55.01;26;7.04;15;3.62;1;8;5;36.35
7;"Universidade Estadual de Maringá (UEM)";PR;Pública;6;31;9;50.72;41;6.47;11;3.73;1;8;7;32.52
8;"Universidade Federal de Minas Gerais (UFMG)";MG;Pública;6;31;10;50.68;30;6.89;28;3.27;1;8;7;32.52
9;"Universidade Federal de Santa Catarina (UFSC)";SC;Pública;15;22;7;51.64;22;7.2;4;3.92;1;8;7;32.52
10;"Universidade Estadual de Londrina (UEL)";PR;Pública;15;22;8;51.45;24;7.12;8;3.81;1;8;7;32.52
11;"Universidade Federal de Pelotas (UFPEL)";RS;Pública;15;22;12;49.89;10;7.66;85;1.71;1;8;7;32.52
12;"Universidade Federal de São Carlos (UFSCAR)";SP;Pública;4;33;17;37.73;7;7.77;44;2.83;1;8;14;19.13
13;"Universidade Federal de Uberlândia (UFU)";MG;Pública;15;22;13;48.1;16;7.43;14;3.65;92;4.5;7;32.52
14;"Universidade Federal do Paraná (UFPR)";PR;Pública;6;31;16;38.26;13;7.54;16;3.59;1;8;14;19.13
15;"Universidade Federal do Ceará (UFC)";CE;Pública;6;31;18;37.05;19;7.31;52;2.61;1;8;14;19.13
16;"Universidade Federal de Goiás (UFG)";GO;Pública;6;31;19;37.04;35;6.7;30;3.21;1;8;14;19.13
17;"Universidade Federal do Espírito Santo (UFES)";ES;Pública;15;22;15;38.47;12;7.58;10;3.76;1;8;14;19.13
18;"Universidade Federal de Mato Grosso do Sul (UFMS)";MS;Pública;15;22;23;32.97;34;6.74;47;2.75;96;4.35;14;19.13
19;"Universidade Federal Rural do Rio de Janeiro (UFRRJ)";RJ;Pública;0;0;11;50.23;29;6.93;46;2.78;1;8;7;32.52
20;"Universidade Federal de Mato Grosso (UFMT)";MT;Pública;6;31;44;15.91;78;5.05;43;2.86;1;8;0;0
21;"Universidade do Estado de Mato Grosso (UNEMAT)";MT;Pública;6;31;63;13.8;101;4.17;88;1.63;1;8;;
22;"Universidade Tecnológica Federal do Paraná (UTFPR)";PR;Pública;15;22;27;18.38;42;6.43;3;3.95;1;8;0;0
23;"Universidade Estadual de Ponta Grossa (UEPG)";PR;Pública;15;22;29;18.18;45;6.32;6;3.86;1;8;;
24;"Fundação Universidade Federal do Tocantins (UFT)";TO;Pública;15;22;32;17.57;21;7.23;62;2.34;1;8;;
25;"Universidade Estadual de Santa Cruz (UESC)";BA;Pública;15;22;35;17.07;54;5.97;34;3.1;1;8;;
26;"Universidade Federal dos Vales do Jequitinhonha e Mucuri (UFVJM)";MG;Pública;15;22;38;16.71;63;5.63;35;3.08;1;8;;
27;"Universidade de Brasília (UNB)";DF;Pública;0;0;14;38.52;9;7.69;12;3.7;1;8;14;19.13
28;"Universidade Federal da Paraíba (UFPB)";PB;Pública;15;22;40;16.28;37;6.62;87;1.66;1;8;0;0
29;"Universidade de Cuiabá (UNIC / PITÁGORAS)";MT;Privada;15;22;54;14.38;130;3.06;26;3.32;1;8;;
30;"Universidade Federal do Pará (UFPA)";PA;Pública;15;22;58;14.12;51;6.09;147;0.03;1;8;0;0
31;"Faculdades Integradas de Bauru (FIB)";SP;Privada;15;22;62;13.86;57;5.86;;;1;8;;
32;"Universidade Federal Rural do Semi-Árido (UFERSA)";RN;Pública;0;0;20;35.82;40;6.51;68;2.18;1;8;14;19.13
33;"Universidade Estadual do Norte Fluminense Darcy Ribeiro (UENF)";RJ;Pública;0;0;21;35.65;1;8;129;0.52;1;8;14;19.13
34;"Fundação Universidade Federal da Grande Dourados (UFGD)";MS;Pública;15;22;71;13.2;56;5.9;42;2.88;94;4.42;;
35;"Universidade Federal Rural de Pernambuco (UFRPE)";PE;Pública;;;22;34.99;38;6.58;101;1.28;1;8;14;19.13
36;"Faculdade Doutor Francisco Maeda (FAFRAM)";SP;Privada;15;22;103;9.69;69;5.4;95;1.44;135;2.85;0;0
37;"Universidade de Rio Verde (FESURV)";GO;Pública;15;22;107;9.42;126;3.22;90;1.58;89;4.62;;
38;"Universidade de Passo Fundo (UPF)";RS;Privada;15;22;112;9.09;92;4.52;59;2.42;153;2.15;0;0
39;"Universidade de Caxias do Sul (UCS)";RS;Privada;15;22;113;8.85;77;5.09;58;2.45;175;1.31;0;0
40;"Universidade do Oeste de Santa Catarina (UNOESC)";SC;Pública;15;22;151;6.06;168;1.61;51;2.64;162;1.81;;
41;"Faculdades Associadas de Uberaba (FAZU)";MG;Privada;15;22;184;3.87;191;0.73;106;1.14;157;2;0;0
42;"Universidade Estadual do Oeste do Paraná (UNIOESTE)";PR;Pública;;;24;19.19;11;7.62;17;3.57;1;8;0;0
43;"Universidade Federal de São João Del Rei (UFSJ)";MG;Pública;;;25;19.1;6;7.81;27;3.29;1;8;0;0
44;"Fundação Universidade Federal do Pampa (UNIPAMPA)";RS;Pública;;;26;18.89;18;7.35;18;3.54;1;8;0;0
45;"Universidade Federal do Recôncavo da Bahia (UFRB)";BA;Pública;;;28;18.22;14;7.5;48;2.72;1;8;0;0
46;"Universidade Federal de Sergipe (UFS)";SE;Pública;0;0;30;17.88;25;7.08;45;2.8;1;8;;
47;"Fundação Universidade Federal do Vale do São Francisco (UNIVASF)";PE;Pública;;;31;17.82;58;5.82;1;4;1;8;;
48;"Universidade Federal de Roraima (UFRR)";RR;Pública;;;33;17.52;43;6.39;33;3.13;1;8;;
49;"Universidade Estadual de Montes Claros (UNIMONTES)";MG;Pública;0;0;34;17.33;55;5.93;23;3.4;1;8;0;0
50;"Universidade Federal de Campina Grande (UFCG)";PB;Pública;0;0;36;17;31;6.85;69;2.15;1;8;;
51;"Fundação Universidade Federal de Rondônia (UNIR)";RO;Pública;0;0;37;16.72;49;6.16;54;2.56;1;8;;
52;"Universidade Estadual do Sudoeste da Bahia (UESB)";BA;Pública;0;0;39;16.51;88;4.67;7;3.84;1;8;;
53;"Instituto Federal de Educação, Ciência e Tecnologia do Sul de Minas Gerais (IF SUL DE MINAS)";MG;Pública;0;0;40;16.28;84;4.82;21;3.46;1;8;;
54;"Universidade Federal de Alagoas (UFAL)";AL;Pública;;;42;16.2;20;7.27;114;0.93;1;8;;
55;"Universidade Federal do Cariri (UFCA)";CE;Pública;;;43;16.02;48;6.2;81;1.82;1;8;;
56;"Universidade da Integração Internacional da Lusofonia Afro-Brasileira (UNILAB)";CE;Pública;;;45;15.89;4;7.89;;;1;8;;
57;"Faculdade Anglo-Americano de Passo Fundo (FAAPF)";RS;Privada;;;46;15.46;15;7.46;;;1;8;;
58;"Faculdade de Ciências Sociais e Agrárias de Itapeva (FAIT)";SP;Privada;;;47;15.2;66;5.51;86;1.69;1;8;;
59;"Universidade Federal do Oeste da Bahia (UFOB)";BA;Pública;;;48;15.01;27;7.01;;;1;8;;
60;"Universidade Federal do Oeste do Pará (UFOPA)";PA;Pública;0;0;49;14.97;28;6.97;;;1;8;0;0
61;"Universidade Federal do Rio Grande do Norte (UFRN)";RN;Pública;0;0;50;14.81;32;6.81;;;1;8;;
62;"Universidade Anhanguera (UNIDERP)";MS;Privada;;;51;14.79;83;4.86;77;1.93;1;8;;
63;"Faculdade de Ciências Humanas e Sociais (FACULDADE AGES)";BA;Privada;;;52;14.66;36;6.66;;;1;8;;
64;"Universidade Federal do Piauí (UFPI)";PI;Pública;0;0;53;14.56;79;5.01;91;1.55;1;8;;
65;"Instituto Federal de Educação, Ciência e Tecnologia do Triângulo Mineiro";MG;Pública;;;55;14.37;52;6.05;9;3.78;91;4.54;;
66;"Universidade Estadual do Norte do Paraná (UENP)";PR;Pública;;;56;14.34;80;4.98;98;1.36;1;8;;
67;"Faculdade de Getúlio Vargas (FACULDADE IDEAU)";RS;Privada;;;57;14.2;124;3.29;41;2.91;1;8;;
68;"Instituto Federal de Educação, Ciência e Tecnologia de Mato Grosso (IFMT)";MT;Pública;;;59;14.07;139;2.72;25;3.35;1;8;;
69;"Instituto Federal de Educação, Ciência e Tecnologia do Paraná (IFPR)";PR;Pública;;;60;14.04;132;2.99;36;3.05;1;8;;
70;"Universidade Estadual do Centro Oeste (UNICENTRO)";PR;Pública;;;61;13.98;39;6.55;22;3.43;105;4;0;0
71;"Instituto Federal de Educação, Ciência e Tecnologia do Norte de Minas Gerais (IFNMG)";MG;Pública;;;64;13.78;150;2.3;20;3.48;1;8;;
72;"Universidade do Estado da Bahia (UNEB)";BA;Pública;0;0;65;13.77;94;4.44;99;1.33;1;8;;
73;"Universidade Federal Rural da Amazônia (UFRA)";PA;Pública;;;66;13.74;68;5.44;137;0.3;1;8;0;0
74;"União das Faculdades dos Grandes Lagos (UNILAGO)";SP;Privada;;;67;13.55;65;5.55;;;1;8;;
75;"Universidade Federal do Amazonas (UFAM)";AM;Pública;;;68;13.53;89;4.63;115;0.9;1;8;;
76;"Instituto Federal de Educação, Ciência e Tecnologia do Espírito Santo (IFES)";ES;Pública;0;0;69;13.28;72;5.28;;;1;8;;
77;"Faculdade Espírito Santense (UNICAPE)";ES;Privada;;;70;13.24;90;4.59;124;0.65;1;8;;
78;"Universidade José do Rosário Vellano (UNIFENAS)";MG;Privada;0;0;72;13.15;46;6.28;31;3.18;113;3.69;;
79;"Universidade Federal do Maranhão (UFMA)";MA;Pública;0;0;73;13.05;105;4.02;110;1.03;1;8;;
80;"Faculdade Dom Luis de Orleans e Bragança (FARRP)";BA;Privada;;;74;12.94;81;4.94;;;1;8;;
81;"Universidade Estadual de Feira de Santana (UEFS)";BA;Pública;;;75;12.79;85;4.79;;;1;8;;
82;"Instituto Federal de Educação, Ciência e Tecnologia Goiano (IF Goiano)";GO;Pública;;;76;12.6;86;4.75;32;3.16;87;4.69;;
83;"Centro Universitário de Várzea Grande (UNIVAG)";MT;Privada;0;0;77;12.45;33;6.78;60;2.4;124;3.27;;
84;"Instituto Federal de Educação, Ciência e Tecnologia Baiano (IFBAIANO)";BA;Pública;;;78;12.33;97;4.33;;;1;8;;
85;"Universidade Estadual de Goiás (UEG)";GO;Pública;;;79;12.3;158;1.99;63;2.31;1;8;;
86;"Universidade Estadual do Rio Grande do Sul (UERGS)";RS;Pública;;;80;12.06;104;4.06;;;1;8;;
86;"Universidade Federal do Sul e Sudeste do Pará (UNIFESSPA)";PA;Pública;;;80;12.06;106;3.98;145;0.08;1;8;;
88;"Faculdade de Ensino Superior e Formação Integral (FAEF)";SP;Privada;;;82;11.86;119;3.48;134;0.38;1;8;;
89;"Universidade Católica Dom Bosco (UCDB)";MS;Privada;;;83;11.84;73;5.24;57;2.48;102;4.12;;
90;"Universidade do Tocantins (UNITINS)";TO;Pública;;;84;11.71;113;3.71;;;1;8;;
91;"Fundação Universidade do Estado de Santa Catarina (UDESC)";SC;Pública;0;0;85;11.63;53;6.01;39;2.97;140;2.65;0;0
92;"Universidade Federal do Acre (UFAC)";AC;Pública;;;86;11.59;144;2.53;109;1.06;1;8;;
93;"Instituto Federal de Educação, Ciência e Tecnologia de Minas Gerais (IFMG)";MG;Pública;0;0;87;11.35;114;3.68;40;2.94;86;4.73;;
94;"Faculdade Integral Cantareira (F.I.C.)";SP;Privada;;;88;10.77;62;5.67;78;1.91;126;3.19;;
95;"Faculdade Interamericana de Porto Velho (UNIRON)";RO;Privada;;;89;10.76;138;2.76;;;1;8;;
96;"Centro Universitário Filadélfia (UNIFIL)";PR;Privada;;;90;10.75;96;4.36;2;3.97;146;2.42;0;0
97;"Centro Universitário de Maringá (UNICESUMAR)";PR;Privada;;;91;10.63;103;4.1;65;2.26;98;4.27;0;0
98;"Pontifícia Universidade Católica do Paraná (PUCPR)";PR;Privada;0;0;92;10.28;99;4.25;55;2.53;118;3.5;0;0
99;"Centro Universitário Luterano de Ji-Paraná (CEULJI/ULBRA)";RO;Privada;;;93;10.02;177;1.26;120;0.76;1;8;;
100;"Centro Universitário de Mineiros (UNIFIMES)";GO;Pública;;;94;9.98;164;1.76;140;0.22;1;8;;
101;"Universidade do Oeste Paulista (UNOESTE)";SP;Privada;0;0;95;9.96;61;5.7;117;0.84;120;3.42;0;0
102;"Universidade Estadual do Maranhão (UEMA)";MA;Pública;;;96;9.95;109;3.87;70;2.12;106;3.96;;
103;"Instituto Federal de Educação, Ciência e Tecnologia do Rio Grande do Sul (IFRS)";RS;Pública;;;97;9.9;71;5.32;;;90;4.58;;
104;"Universidade de Marília (UNIMAR)";SP;Privada;0;0;98;9.84;44;6.35;116;0.87;141;2.62;;
105;"Instituto Federal de Educação, Ciência e Tecnologia do Ceará (IFCE)";CE;Pública;;;99;9.8;163;1.8;;;1;8;;
106;"Universidade Federal da Fronteira Sul (UFFS)";SC;Pública;;;100;9.78;67;5.47;;;97;4.31;0;0
107;"Faculdade de Filosofia e Ciências Humanas de Goiatuba (FAFICH)";GO;Pública;;;101;9.76;169;1.57;141;0.19;1;8;;
108;"Faculdades Integradas de Ourinhos (FIO)";SP;Privada;0;0;102;9.71;98;4.29;76;1.96;119;3.46;;
109;"Universidade Estadual do Piauí (UESPI)";PI;Pública;0;0;104;9.61;120;3.45;83;1.77;95;4.39;;
110;"Faculdade Montes Belos (FMB)";GO;Privada;;;105;9.54;75;5.17;143;0.14;99;4.23;;
111;"Instituto Federal de Educação, Ciência e Tecnologia de Pernambuco (IFPE)";PE;Pública;;;106;9.53;170;1.53;;;1;8;;
112;"Instituto Federal de Educação, Ciência e Tecnologia do Sertão Pernambucano";PE;Pública;;;108;9.42;173;1.42;;;1;8;;
113;"Centro Universitário da Fundação Educacional de Barretos (UNIFEB)";SP;Privada;;;109;9.37;23;7.16;105;1.17;182;1.04;;
114;"Universidade Luterana do Brasil (ULBRA)";RS;Privada;;;110;9.26;121;3.41;73;2.04;110;3.81;;
115;"Universidade Regional do Noroeste do Estado do Rio Grande do Sul (UNIJUI)";RS;Privada;0;0;111;9.21;112;3.75;66;2.23;125;3.23;0;0
116;"Universidade de Taubaté (UNITAU)";SP;Pública;;;114;8.67;82;4.9;;;111;3.77;;
117;"Instituto Federal de Educação, Ciência e Tecnologia de Rondônia (IFRO)";RO;Pública;;;115;8.65;193;0.65;;;1;8;;
118;"Instituto Federal de Educação, Ciência e Tecnologia do Tocantins (IFTO)";TO;Pública;;;116;8.5;197;0.5;;;1;8;;
119;"Instituto Federal de Educação, Ciência e Tecnologia do Maranhão (IFMA)";MA;Pública;;;117;8.38;200;0.38;;;1;8;;
120;"Universidade do Sagrado Coração (USC)";SP;Privada;0;0;118;8.32;64;5.59;;;138;2.73;;
121;"Faculdade de Estudos Superiores de Minas Gerais (FEAD)";MG;Privada;;;119;8.3;100;4.21;19;3.51;194;0.58;;
122;"Centro Universitário de Araras (UNAR)";SP;Privada;;;120;8.29;74;5.21;;;129;3.08;;
123;"Faculdades Integradas de Três Lagoas (AEMS)";MS;Privada;;;121;8.28;76;5.13;;;127;3.15;;
124;"Instituto Federal de Educação, Ciência e Tecnologia do Pará (IFPA)";PA;Pública;;;122;8.23;156;2.07;74;2.01;101;4.15;;
125;"Faculdade de Ciências Humanas e Sociais (FUCAMP)";MG;Privada;;;123;8.22;123;3.33;93;1.5;121;3.39;;
126;"Faculdade de Ciências Agrárias e Exatas de Primavera do Leste";MT;Privada;;;124;8.12;127;3.18;108;1.09;109;3.85;;
127;"Centro Universitário Dinâmica das Cataratas (UDC)";PR;Privada;;;125;8.04;160;1.91;53;2.59;117;3.54;;
128;"Instituto Federal de Educação, Ciência e Tecnologia do Sudeste de Minas Gerais (IFSEMG)";MG;Pública;;;126;8.02;117;3.56;;;93;4.46;;
129;"Centro Universitário Moura Lacerda (CUML)";SP;Privada;0;0;127;7.88;50;6.12;130;0.49;176;1.27;;
130;"Instituto Federal de Educação, Ciência e Tecnologia Catarinense (IF Catarinense)";SC;Pública;;;128;7.82;108;3.9;;;107;3.92;;
131;"Faculdade Campo Real (CAMPO REAL)";PR;Privada;0;0;129;7.7;128;3.14;61;2.37;152;2.19;;
132;"Universidade Estadual de Mato Grosso do Sul (UEMS)";MS;Pública;0;0;130;7.59;91;4.56;72;2.07;184;0.96;0;0
133;"Faculdade Assis Gurgacz (FAG)";PR;Privada;;;131;7.47;147;2.41;50;2.67;147;2.39;;
134;"Faculdade Integrado de Campo Mourão (CEI)";PR;Privada;0;0;132;7.24;116;3.6;75;1.99;166;1.65;;
135;"Faculdades Adamantinenses Integradas (FAI)";SP;Pública;;;133;7.23;133;2.95;84;1.74;143;2.54;;
136;"Universidade Norte do Paraná (UNOPAR)";PR;Privada;0;0;134;7.22;115;3.64;;;116;3.58;;
137;"Centro Universitário Central Paulista (UNICEP)";SP;Privada;;;135;7.16;47;6.24;;;185;0.92;;
138;"Centro Universitário da Grande Dourados (UNIGRAN)";MS;Privada;0;0;136;7.14;111;3.79;;;122;3.35;0;0
138;"Centro Universitário do Planalto de Araxá (UNIARAXÁ)";MG;Privada;;;136;7.14;146;2.45;79;1.88;136;2.81;;
140;"Universidade do Sul de Santa Catarina (UNISUL)";SC;Privada;0;0;138;6.8;152;2.22;49;2.69;160;1.89;;
141;"Faculdades Integradas Promove de Brasilia";DF;Privada;;;139;6.75;129;3.1;56;2.5;179;1.15;;
142;"Universidade Regional Integrada do Alto Uruguai e das Missões (URI)";RS;Privada;0;0;140;6.67;134;2.91;82;1.8;158;1.96;;
143;"Faculdade de Ensino Superior Santa Barbara (FAESB)";SP;Privada;;;141;6.62;135;2.87;119;0.79;132;2.96;;
144;"Universidade de Cruz Alta (UNICRUZ)";RS;Privada;;;142;6.58;122;3.37;92;1.52;165;1.69;;
145;"Centro Universitário de Goiás (UNI-ANHANGÜERA)";GO;Privada;;;143;6.56;95;4.4;97;1.39;189;0.77;;
146;"Centro Regional Universitário de Espírito Santo do Pinhal (UNIPINHAL)";SP;Privada;0;0;144;6.43;107;3.94;127;0.57;159;1.92;;
147;"Universidade Comunitária da Região de Chapecó (UNOCHAPECÓ)";SC;Pública;;;145;6.34;155;2.11;128;0.54;113;3.69;;
148;"Faculdades Integradas Stella Maris de Andradina (FISMA)";SP;Privada;;;146;6.28;59;5.78;;;196;0.5;;
148;"Faculdade Eduvale de Avaré (EDUVALE)";SP;Privada;0;0;146;6.28;60;5.74;;;195;0.54;;
150;"Universidade da Região da Campanha (URCAMP)";RS;Privada;;;148;6.25;165;1.72;89;1.61;133;2.92;;
151;"Universidade Camilo Castelo Branco (UNICASTELO)";SP;Privada;0;0;149;6.19;131;3.02;122;0.71;145;2.46;0;0
152;"Faculdades Integradas da Upis (UPIS)";DF;Privada;;;150;6.14;142;2.6;96;1.42;154;2.12;;
153;"Centro Universitário de Araraquara (UNIARA)";SP;Privada;0;0;152;6.05;70;5.36;;;191;0.69;;
154;"Centro Universitário do Norte Paulista (UNORP)";SP;Privada;;;153;5.99;140;2.68;;;123;3.31;;
155;"Centro Universitário Unifafibe (FAFIBE)";SP;Privada;;;154;5.87;110;3.83;;;156;2.04;;
156;"Faculdades Integradas Aparício Carvalho (FIMCA)";RO;Privada;;;155;5.78;185;0.96;121;0.74;103;4.08;;
157;"Universidade Vale do Rio Verde (UNINCOR)";MG;Privada;;;156;5.73;136;2.83;118;0.82;155;2.08;;
158;"Universidade Alto Vale do Rio do Peixe (UNIARP)";SC;Pública;0;0;157;5.53;137;2.79;80;1.85;186;0.89;;
159;"Instituto Luterano de Ensino Superior de Itumbiara (ILES)";GO;Privada;;;158;5.44;196;0.54;139;0.25;88;4.65;;
160;"Universidade do Estado de Minas Gerais (UEMG)";MG;Pública;;;159;5.42;174;1.38;;;104;4.04;;
161;"Faculdade Arnaldo Horácio Ferreira (FAAHF)";BA;Privada;0;0;160;5.39;192;0.69;29;3.24;171;1.46;;
162;"Universidade de Sorocaba (UNISO)";SP;Privada;;;161;5.33;93;4.48;;;187;0.85;;
162;"Centro Universitário de Rio Preto (UNIRP)";SP;Privada;;;161;5.33;87;4.71;;;193;0.62;;
164;"Centro Universitário Luterano de Santarém (CEULS)";PA;Privada;;;163;5.17;194;0.61;136;0.33;99;4.23;;
165;"Faculdades Integradas do Vale do Iguaçu";PR;Privada;;;164;5.13;159;1.95;71;2.1;181;1.08;;
166;"Faculdade Educacional de Dois Vizinhos (FAED)";PR;Privada;;;165;5.08;172;1.46;;;115;3.62;;
167;"Centro Universitário do Cerrado-Patrocínio (UNICERP)";MG;Privada;;;166;4.99;157;2.03;138;0.27;139;2.69;;
168;"Instituto Taquaritinguense de Ensino Superior Dr. Aristides de Carvalho Schlobach (ITES)";SP;Privada;;;167;4.98;102;4.13;131;0.46;199;0.39;;
169;"Faculdade da Amazônia (FAMA)";RO;Privada;;;168;4.93;208;0.08;107;1.12;112;3.73;;
170;"Faculdade Três de Maio (SETREM)";RS;Privada;;;169;4.9;182;1.07;24;3.37;197;0.46;;
171;"Faculdade Anhangüera de Dourados (FAD)";MS;Privada;0;0;170;4.85;149;2.34;142;0.16;148;2.35;;
172;"Faculdade Ingá";PR;Privada;;;171;4.84;162;1.84;;;131;3;;
173;"Universidade Estadual de Roraima (UERR)";RR;Pública;;;172;4.81;151;2.26;146;0.05;144;2.5;;
174;"Faculdade Centro Mato-Grossense";MT;Privada;;;173;4.66;186;0.92;67;2.2;169;1.54;;
175;"Universidade Paranaense (UNIPAR)";PR;Privada;0;0;174;4.64;125;3.25;;;173;1.39;;
176;"Centro Superior de Ensino e Pesquisa de Machado (CESEP)";MG;Privada;;;175;4.56;181;1.11;133;0.41;130;3.04;;
177;"Faculdade Anhanguera de Rondonópolis (FAR)";MT;Privada;0;0;176;4.55;189;0.8;112;0.98;137;2.77;;
178;"Faculdade Vértice (VÉRTICE)";MG;Privada;;;177;4.51;183;1.03;64;2.29;178;1.19;;
179;"Faculdade Gammon";SP;Privada;0;0;178;4.49;148;2.37;135;0.35;163;1.77;;
180;"Faculdade Católica do Tocantins (FACTO)";TO;Privada;;;179;4.42;166;1.68;111;1.01;164;1.73;;
181;"Faculdade de Itapiranga (SEI/FAI)";SC;Privada;;;180;4.27;176;1.3;94;1.47;170;1.5;;
182;"Faculdade Anglo-Americana de Bagé (FAABA)";RS;Privada;;;181;4.23;167;1.65;;;142;2.58;;
183;"Faculdade de Tecnologia Paulista";SP;Privada;;;182;3.92;143;2.57;;;174;1.35;;
184;"Faculdade do Noroeste de Minas (FINOM)";MG;Privada;;;183;3.91;201;0.34;123;0.68;134;2.89;;
185;"Faculdade São Francisco de Barreiras (FASB)";BA;Privada;0;0;185;3.83;161;1.88;103;1.22;190;0.73;;
186;"Centro Universitário de Patos de Minas (UNIPAM)";MG;Privada;0;0;186;3.64;141;2.64;;;183;1;0;0
187;"Instituto Municipal de Ensino Superior de Bebedouro Victório Cardassi (IMESB)";SP;Pública;;;187;3.6;118;3.52;;;207;0.08;;
188;"Faculdade Cidade de Coromandel (FCC)";MG;Privada;;;188;3.58;198;0.46;;;128;3.12;;
189;"Centro Universitário do Sul de Minas (UNIS-MG)";MG;Privada;;;189;3.46;178;1.23;;;151;2.23;;
190;"Faculdade do Nordeste da Bahia (FANEB)";BA;Privada;;;190;3.41;153;2.18;;;177;1.23;;
191;"União de Ensino Superior de Nova Mutum (UNINOVA)";MT;Pública;0;0;191;3.34;207;0.12;113;0.95;150;2.27;;
192;"Faculdade Presidente Antônio Carlos de Bom Despacho (FAPACBD)";MG;Privada;;;192;3.13;202;0.31;104;1.2;167;1.62;;
193;"Faculdades Integradas dos Campos Gerais (CESCAGE)";PR;Privada;0;0;193;3.11;180;1.15;100;1.31;192;0.65;;
194;"Faculdade Presidente Antônio Carlos de Uberlândia";MG;Privada;;;194;3.06;184;1;102;1.25;188;0.81;;
195;"Centro Universitário de Anápolis (UNIEVANGÉLICA)";GO;Privada;;;195;2.8;145;2.49;;;201;0.31;;
196;"Faculdade Metropolitana de Anápolis (FAMA)";GO;Privada;;;196;2.54;204;0.23;;;149;2.31;;
197;"Centro Universitário Fundação de Ensino Octávio Bastos (UNIFEOB)";SP;Privada;;;197;2.46;175;1.34;;;180;1.12;;
198;"Faculdades Unidas do Vale do Araguaia (UNIVAR)";MT;Privada;;;198;2.42;195;0.57;;;161;1.85;;
199;"Centro Universitário Católico Salesiano Auxilium (UNISALESIANO)";SP;Privada;;;199;2.37;154;2.14;;;203;0.23;;
200;"Faculdade Roraimense de Ensino Superior (FARES)";RR;Privada;;;200;2.28;199;0.42;132;0.44;172;1.42;;
201;"Faculdade de Ciências e Tecnologia de Unaí (FACTU)";MG;Privada;;;201;1.89;188;0.84;125;0.63;198;0.42;;
202;"Centro Universitário do Triângulo (UNITRI)";MG;Privada;0;0;202;1.76;171;1.49;;;202;0.27;;
203;"Faculdade Guaraí (FAG)";TO;Privada;;;203;1.73;206;0.15;;;168;1.58;;
204;"Centro Universitário de Formiga (UNIFORMG)";MG;Privada;;;204;1.38;179;1.19;;;204;0.19;;
205;"Centro Universitário Barriga Verde (UNIBAVE)";SC;Pública;;;205;1.12;190;0.77;;;200;0.35;;
206;"Faculdade Evangélica de Goianésia";GO;Privada;;;206;1.03;187;0.88;;;205;0.15;;
207;"Universidade Vale do Rio Doce (UNIVALE)";MG;Privada;;;207;0.83;205;0.19;126;0.6;208;0.04;;
208;"Faculdade Concórdia (FACC)";SC;Privada;;;208;0.39;203;0.27;;;206;0.12;;
209;"Faculdade de Ciências Agrárias de Araripina (FACIAGRA)";PE;Pública;;;209;0.15;209;0.04;144;0.11;;;;
