Posição;Nome;Estado;"Pública ou Privada";"Posição em avaliação do Mercado";"Nota em avaliação do Mercado";"Posição em qualidade de ensino";"Nota em qualidade de ensino";"Posição em Instrução dos Professores";"Nota em Instrução dos Professores";"Posição Nota dos concluintes";"Nota dos concluintes";"Posição em Tempo de Dedicação dos Professores";"Nota em Tempo de Dedicação dos Professores";"Posição no MEC";"Nota no MEC"
1;"Universidade de São Paulo (USP)";SP;Pública;1;36;3;59.98;2;7.98;;;1;8;1;44
2;"Universidade Federal do Rio de Janeiro (UFRJ)";RJ;Pública;6;34.04;1;61.78;5;7.94;16;3.75;1;8;2;42.09
3;"Universidade Estadual de Campinas (UNICAMP)";SP;Pública;6;34.04;2;61.05;6;7.92;58;3.04;1;8;2;42.09
4;"Universidade Federal de Minas Gerais (UFMG)";MG;Pública;2;35.61;4;58;8;7.89;10;3.85;1;8;4;38.26
5;"Universidade Federal do Rio Grande do Sul (UFRGS)";RS;Pública;13;31.3;5;57.66;11;7.84;27;3.56;1;8;4;38.26
6;"Universidade Federal de Santa Catarina (UFSC)";SC;Pública;13;31.3;6;53.57;20;7.7;35;3.43;1;8;6;34.44
7;"Universidade Estadual Paulista Júlio de Mesquita Filho (UNESP)";SP;Pública;13;31.3;9;48.08;3;7.97;56;3.08;224;4.51;7;32.52
8;"Universidade Federal do Paraná (UFPR)";PR;Pública;6;34.04;14;43.88;42;7.36;22;3.65;1;8;11;24.87
9;"Pontifícia Universidade Católica do Rio de Janeiro (PUC-RIO)";RJ;Privada;13;31.3;10;45.29;31;7.53;59;3.03;371;2.21;7;32.52
10;"Universidade Federal de Pernambuco (UFPE)";PE;Pública;13;31.3;12;44.18;26;7.61;19;3.7;1;8;11;24.87
11;"Universidade Federal de São Carlos (UFSCAR)";SP;Pública;32;23.87;7;51.38;4;7.95;66;2.91;1;8;7;32.52
12;"Universidade do Vale do Rio dos Sinos (UNISINOS)";RS;Privada;6;34.04;15;40.21;51;7.22;53;3.13;193;4.99;11;24.87
13;"Universidade Presbiteriana Mackenzie (MACKENZIE)";SP;Privada;2;35.61;16;36.15;75;6.85;64;2.94;417;1.49;11;24.87
14;"Universidade de Brasília (UNB)";DF;Pública;32;23.87;11;44.63;10;7.86;7;3.9;1;8;11;24.87
15;"Universidade Federal de Viçosa (UFV)";MG;Pública;32;23.87;13;44.13;41;7.38;8;3.88;1;8;11;24.87
16;"Universidade Federal Fluminense (UFF)";RJ;Pública;13;31.3;17;32.55;15;7.78;38;3.38;1;8;17;13.39
17;"Universidade Estadual de Maringá (UEM)";PR;Pública;13;31.3;18;32.35;66;6.99;3;3.97;1;8;17;13.39
18;"Universidade Federal da Bahia (UFBA)";BA;Pública;13;31.3;19;29.11;188;5.08;82;2.64;1;8;17;13.39
19;"Centro Universitário da Fundação Educacional Inaciana Pe Sabóia de Medeiros (FEI)";SP;Privada;6;34.04;22;23.6;70;6.92;115;2.08;435;1.21;17;13.39
20;"Pontifícia Universidade Católica do Rio Grande do Sul (PUCRS)";RS;Privada;13;31.3;20;25.21;59;7.1;152;1.46;304;3.26;17;13.39
21;"Centro Universitário do Instituto Mauá de Tecnologia (CEUN-IMT)";SP;Privada;13;31.3;23;23.55;145;5.75;42;3.31;442;1.1;17;13.39
22;"Universidade Federal do Ceará (UFC)";CE;Pública;6;34.04;24;19.52;13;7.81;18;3.71;1;8;0;0
23;"Universidade Federal de Goiás (UFG)";GO;Pública;13;31.3;33;18.85;64;7.02;11;3.83;1;8;0;0
24;"Instituto Tecnológico de Aeronáutica (ITA)";SP;Pública;0;0;8;49.94;9;7.88;1;4;158;5.54;7;32.52
25;"Universidade Federal de Sergipe (UFS)";SE;Pública;13;31.3;42;18.28;86;6.67;24;3.61;1;8;;
26;"Universidade Paulista (UNIP)";SP;Privada;2;35.61;130;12.33;156;5.58;112;2.13;217;4.62;0;0
27;"Universidade do Estado do Rio de Janeiro (UERJ)";RJ;Pública;13;31.3;68;15.54;33;7.5;83;2.62;166;5.42;0;0
28;"Pontifícia Universidade Católica de Minas Gerais (PUC MINAS)";MG;Privada;2;35.61;179;10.48;159;5.54;105;2.25;340;2.69;;
29;"Pontifícia Universidade Católica de São Paulo (PUCSP)";SP;Privada;13;31.3;107;13.53;17;7.75;;;143;5.78;;
30;"Universidade Federal do Espírito Santo (UFES)";ES;Pública;32;23.87;25;19.28;30;7.55;17;3.73;1;8;;
31;"Universidade Federal da Paraíba (UFPB)";PB;Pública;32;23.87;26;19.12;19;7.72;37;3.4;1;8;0;0
31;"Universidade Federal de Juiz de Fora (UFJF)";MG;Pública;32;23.87;26;19.12;24;7.64;32;3.48;1;8;0;0
33;"Universidade Federal de Alagoas (UFAL)";AL;Pública;32;23.87;29;19.01;29;7.56;34;3.45;1;8;0;0
34;"Universidade Fumec (FUMEC)";MG;Privada;6;34.04;253;8.82;236;4.34;169;1.18;301;3.3;;
35;"Universidade Federal de Santa Maria (UFSM)";RS;Pública;32;23.87;31;18.94;54;7.17;15;3.77;1;8;0;0
36;"Universidade Federal de Ouro Preto (UFOP)";MG;Pública;32;23.87;35;18.68;35;7.47;48;3.21;1;8;;
37;"Fundação Universidade Federal do Tocantins (UFT)";TO;Pública;32;23.87;36;18.65;79;6.78;9;3.87;1;8;;
38;"Universidade Federal de Campina Grande (UFCG)";PB;Pública;32;23.87;37;18.51;44;7.33;50;3.18;1;8;0;0
39;"Pontifícia Universidade Católica do Paraná (PUCPR)";PR;Privada;13;31.3;162;11.07;182;5.18;72;2.81;315;3.08;0;0
40;"Universidade Tecnológica Federal do Paraná (UTFPR)";PR;Pública;32;23.87;40;18.33;77;6.82;30;3.51;1;8;0;0
41;"Universidade Federal do Rio Grande do Norte (UFRN)";RN;Pública;32;23.87;43;18.18;69;6.94;46;3.24;1;8;0;0
42;"Universidade Católica de Pernambuco (UNICAP)";PE;Privada;13;31.3;215;9.73;83;6.72;145;1.58;421;1.43;0;0
43;"Pontifícia Universidade Católica de Campinas (PUC-CAMPINAS)";SP;Privada;13;31.3;217;9.71;101;6.44;78;2.71;476;0.56;0;0
44;"Universidade Federal do Piauí (UFPI)";PI;Pública;32;23.87;62;15.98;232;4.4;26;3.58;1;8;;
45;"Universidade Federal do Amazonas (UFAM)";AM;Pública;32;23.87;65;15.77;214;4.68;55;3.09;1;8;0;0
46;"Universidade Estadual do Piauí (UESPI)";PI;Pública;32;23.87;74;15.35;254;4.06;43;3.29;1;8;;
47;"Universidade de Pernambuco (UPE)";PE;Pública;32;23.87;76;15.33;231;4.41;65;2.92;1;8;;
48;"Universidade de Fortaleza (UNIFOR)";CE;Privada;13;31.3;338;6.97;223;4.54;162;1.29;439;1.14;;
49;"Centro Universitário de Maringá (UNICESUMAR)";PR;Privada;32;23.87;103;13.89;104;6.39;74;2.77;210;4.73;;
50;"Universidade Positivo (UP)";PR;Privada;32;23.87;109;13.4;89;6.63;86;2.57;244;4.2;;
51;"Universidade de Caxias do Sul (UCS)";RS;Privada;32;23.87;118;12.96;52;7.21;52;3.14;345;2.61;;
52;"Centro Universitário de João Pessoa (UNIPÊ)";PB;Privada;32;23.87;122;12.59;220;4.59;;;1;8;;
53;"Universidade Santa Cecília (UNISANTA)";SP;Privada;32;23.87;128;12.48;138;5.86;146;1.56;189;5.06;;
54;"Pontifícia Universidade Católica de Goiás (PUC GOIÁS)";GO;Privada;13;31.3;411;4.74;343;2.67;173;1.11;451;0.96;;
55;"Faculdade do Centro Leste (UCL)";ES;Privada;32;23.87;132;12.16;206;4.8;81;2.66;212;4.7;;
56;"Universidade Católica de Brasília (UCB)";DF;Privada;32;23.87;152;11.53;142;5.8;97;2.39;299;3.34;;
57;"Faculdade Pio Décimo (FPD)";SE;Privada;32;23.87;154;11.4;121;6.13;197;0.71;221;4.56;;
58;"Universidade São Judas Tadeu (USJT)";SP;Privada;32;23.87;156;11.35;94;6.55;51;3.16;407;1.64;;
59;"Centro Universitário do Leste de Minas Gerais (UNILESTEMG)";MG;Privada;32;23.87;181;10.42;233;4.38;122;1.97;252;4.07;;
60;"Universidade Nove de Julho (UNINOVE)";SP;Privada;32;23.87;194;10.04;153;5.63;224;0.25;246;4.16;;
61;"Centro Universitário Una (UNA)";MG;Privada;32;23.87;196;10.01;126;6.05;142;1.63;363;2.33;;
62;"Universidade Veiga de Almeida (UVA)";RJ;Privada;32;23.87;210;9.78;130;5.99;129;1.85;388;1.94;0;0
63;"Universidade Estácio de Sá (UNESA)";RJ;Privada;32;23.87;211;9.77;140;5.83;189;0.84;314;3.1;;
64;"Faculdade de Engenharia da Fundação Armando Alvares Penteado (FEFAAP)";SP;Privada;32;23.87;212;9.74;85;6.69;61;2.99;508;0.06;;
65;"Universidade de Mogi das Cruzes (UMC)";SP;Privada;32;23.87;232;9.2;201;4.88;227;0.2;249;4.12;;
66;"Universidade de Passo Fundo (UPF)";RS;Privada;32;23.87;240;9.09;209;4.76;77;2.72;409;1.61;;
67;"Universidade Regional de Blumenau (FURB)";SC;Pública;32;23.87;244;8.98;187;5.1;87;2.56;428;1.32;;
68;"Faculdade Assis Gurgacz (FAG)";PR;Privada;32;23.87;271;8.45;357;2.45;106;2.24;272;3.76;;
69;"Faculdade de Engenharia e Inovação Técnico Profissi (FEITEP)";PR;Privada;32;23.87;272;8.44;243;4.23;;;243;4.21;;
70;"Universidade Tiradentes (UNIT)";SE;Privada;32;23.87;285;8.13;228;4.46;141;1.65;383;2.02;;
71;"Universidade do Sul de Santa Catarina (UNISUL)";SC;Privada;32;23.87;299;7.87;314;3.12;139;1.68;316;3.07;;
72;"Universidade Potiguar (UNP)";RN;Privada;32;23.87;301;7.84;239;4.29;186;0.89;342;2.66;;
73;"Universidade Salvador (UNIFACS)";BA;Privada;32;23.87;304;7.67;252;4.09;151;1.48;378;2.1;;
74;"Centro Universitário Newton Paiva (NEWTON PAIVA)";MG;Privada;32;23.87;305;7.63;307;3.23;99;2.35;381;2.05;;
75;"Universidade Católica do Salvador (UCSAL)";BA;Privada;32;23.87;308;7.59;183;5.16;221;0.3;376;2.13;;
76;"Escola de Engenharia Kennedy (EEK)";MG;Privada;32;23.87;314;7.43;309;3.2;175;1.08;311;3.15;;
77;"Faculdade de Ciência e Tecnologia (ÁREA1)";BA;Privada;32;23.87;325;7.15;370;2.25;;;199;4.9;;
78;"Universidade Regional Integrada do Alto Uruguai e das Missões (URI)";RS;Privada;32;23.87;354;6.43;333;2.82;107;2.22;423;1.39;;
79;"Centro Universitário Augusto Motta (UNISUAM)";RJ;Privada;32;23.87;362;6.12;246;4.18;237;0.03;390;1.91;;
80;"Centro Universitário das Faculdades Metropolitanas Unidas (FMU)";SP;Privada;32;23.87;394;5.35;350;2.56;;;334;2.79;;
81;"Universidade Braz Cubas (UBC)";SP;Privada;32;23.87;421;4.53;431;1.29;;;305;3.24;;
82;"Centro Universitário do Norte (UNINORTE)";AM;Privada;32;23.87;436;4.19;351;2.54;235;0.07;411;1.58;;
83;"Centro Universitário Cesmac (CESMAC)";AL;Privada;32;23.87;483;2.65;420;1.47;208;0.52;470;0.66;;
84;"Faculdade Integrada Metropolitana de Campinas (METROCAMP)";SP;Privada;0;0;21;24.68;111;6.29;166;1.23;271;3.77;17;13.39
85;"Fundação Universidade Federal de Rondônia (UNIR)";RO;Pública;83;3.91;46;17.88;115;6.22;21;3.66;1;8;;
86;"Universidade Federal de Mato Grosso (UFMT)";MT;Pública;83;3.91;49;17.48;113;6.25;47;3.23;1;8;;
87;"Universidade Estadual do Oeste do Paraná (UNIOESTE)";PR;Pública;0;0;28;19.04;39;7.41;23;3.63;1;8;;
88;"Universidade Federal de São João Del Rei (UFSJ)";MG;Pública;0;0;30;18.95;27;7.6;40;3.35;1;8;0;0
89;"Universidade Estadual de Londrina (UEL)";PR;Pública;0;0;32;18.87;62;7.05;12;3.82;1;8;0;0
90;"Universidade Federal dos Vales do Jequitinhonha e Mucuri (UFVJM)";MG;Pública;;;34;18.8;18;7.74;57;3.06;1;8;0;0
91;"Universidade Federal do Triângulo Mineiro (UFTM)";MG;Pública;;;38;18.45;99;6.47;2;3.98;1;8;0;0
92;"Universidade Estadual do Norte Fluminense Darcy Ribeiro (UENF)";RJ;Pública;;;39;18.44;1;8;94;2.44;1;8;;
93;"Universidade Federal de Pelotas (UFPEL)";RS;Pública;0;0;41;18.3;25;7.63;80;2.67;1;8;0;0
94;"Universidade Federal do Cariri (UFCA)";CE;Pública;0;0;44;18.02;32;7.52;90;2.5;1;8;;
95;"Fundação Universidade Federal do Pampa (UNIPAMPA)";RS;Pública;;;45;18;40;7.39;84;2.61;1;8;;
96;"Universidade do Estado do Amazonas (UEA)";AM;Pública;83;3.91;101;14.07;304;3.28;73;2.79;1;8;;
97;"Fundação Universidade Federal do Vale do São Francisco (UNIVASF)";PE;Pública;;;47;17.82;109;6.32;31;3.5;1;8;0;0
98;"Universidade Federal do Oeste da Bahia (UFOB)";BA;Pública;;;48;17.71;118;6.18;29;3.53;1;8;;
99;"Centro Federal de Educação Tecnológica Celso Suckow da Fonseca (CEFET/RJ)";RJ;Pública;;;50;17.21;123;6.1;54;3.11;1;8;;
100;"Universidade Federal Rural do Semi-Árido (UFERSA)";RN;Pública;;;51;17.19;110;6.3;67;2.89;1;8;;
101;"Instituto Federal de Educação, Ciência e Tecnologia de São Paulo (IFSP)";SP;Pública;;;52;17.07;154;5.61;33;3.46;1;8;;
102;"Universidade Federal do Recôncavo da Bahia (UFRB)";BA;Pública;;;53;16.91;72;6.89;119;2.02;1;8;;
103;"Universidade Federal de Uberlândia (UFU)";MG;Pública;;;54;16.78;50;7.24;20;3.68;138;5.86;0;0
104;"Universidade Federal do Rio Grande (FURG)";RS;Pública;;;55;16.76;74;6.86;126;1.9;1;8;0;0
105;"Universidade Estadual de Ponta Grossa (UEPG)";PR;Pública;0;0;56;16.74;205;4.82;6;3.92;1;8;;
106;"Universidade Federal do Pará (UFPA)";PA;Pública;0;0;57;16.68;71;6.91;134;1.77;1;8;0;0
107;"Universidade Federal de Itajubá (UNIFEI)";MG;Pública;0;0;58;16.48;16;7.77;63;2.96;145;5.75;0;0
108;"Instituto Federal de Educação, Ciência e Tecnologia de Sergipe (IFS)";SE;Pública;;;59;16.36;230;4.43;5;3.93;1;8;;
109;"Faculdade Redentor (FACREDENTOR)";RJ;Privada;;;60;16.13;148;5.71;95;2.42;1;8;;
110;"Universidade Federal de Roraima (UFRR)";RR;Pública;0;0;61;16.12;117;6.19;124;1.93;1;8;0;0
111;"Universidade Federal Rural de Pernambuco (UFRPE)";PE;Pública;;;63;15.91;7;7.91;;;1;8;;
112;"Universidade Federal da Integração Latino-Americana (UNILA)";PR;Pública;;;64;15.83;12;7.83;;;1;8;;
113;"Faculdade de Ciências Humanas e Sociais (FACULDADE AGES)";BA;Privada;;;66;15.69;21;7.69;;;1;8;;
114;"Universidade do Oeste Paulista (UNOESTE)";SP;Privada;;;67;15.61;49;7.25;89;2.52;139;5.84;;
115;"Centro Universitário do Rio Grande do Norte (UNI-RN)";RN;Privada;;;69;15.49;34;7.49;;;1;8;;
116;"Universidade Federal de Mato Grosso do Sul (UFMS)";MS;Pública;0;0;70;15.46;73;6.88;36;3.41;182;5.17;;
117;"Fundação Universidade Federal da Grande Dourados (UFGD)";MS;Pública;;;71;15.45;36;7.45;;;1;8;;
117;"Instituto Federal de Educação, Ciência e Tecnologia do Maranhão (IFMA)";MA;Pública;;;71;15.45;264;3.9;28;3.55;1;8;;
119;"Centro Univeristário da Faculdade Estácio de Sá de Belo Horizonte (FESBH)";MG;Privada;;;73;15.44;37;7.44;;;1;8;;
120;"Universidade Estadual de Santa Cruz (UESC)";BA;Pública;;;74;15.35;43;7.35;;;1;8;;
121;"Faculdade Serigy (FASERGY)";SE;Privada;;;77;15.31;45;7.31;;;1;8;;
121;"Faculdade Metropolitana de Blumenau (FAMEBLU)";SC;Privada;;;77;15.31;45;7.31;;;1;8;;
123;"Universidade Estadual do Maranhão (UEMA)";MA;Pública;83;3.91;155;11.38;328;2.9;44;3.28;180;5.2;;
124;"Universidade Estadual da Paraíba (UEPB)";PB;Pública;;;79;15.2;190;5.05;111;2.15;1;8;;
125;"Centro Universitário Facvest (FACVEST)";SC;Privada;;;80;15.16;55;7.16;;;1;8;;
126;"Faculdade Anhanguera de Guarulhos";SP;Privada;;;81;15.08;60;7.08;;;1;8;;
127;"Instituto Federal de Educação, Ciência e Tecnologia de Santa Catarina (IFSC)";SC;Pública;;;82;15.06;61;7.06;;;1;8;0;0
128;"Centro Universitário Campos de Andrade (UNIANDRADE)";PR;Privada;;;83;15.03;63;7.03;;;1;8;;
129;"Instituto Federal de Educação, Ciência e Tecnologia da Bahia (IFBA)";BA;Pública;;;84;14.97;67;6.97;;;1;8;;
130;"Universidade Estadual de Feira de Santana (UEFS)";BA;Pública;;;85;14.75;127;6.04;70;2.84;137;5.87;;
130;"Universidade Federal do Sul e Sudeste do Pará (UNIFESSPA)";PA;Pública;;;85;14.75;81;6.75;;;1;8;;
132;"Universidade Federal do Acre (UFAC)";AC;Pública;0;0;87;14.71;288;3.52;49;3.19;1;8;;
133;"Centro Federal de Educação Tecnológica de Minas Gerais (CEFET/MG)";MG;Pública;0;0;88;14.7;300;3.34;39;3.36;1;8;;
134;"Universidade Estadual de Goiás (UEG)";GO;Pública;;;89;14.67;267;3.85;71;2.82;1;8;;
135;"Faculdade de Ciências Sociais e Agrárias de Itapeva (FAIT)";SP;Privada;;;90;14.64;88;6.64;;;1;8;;
136;"Centro Universitário Anhanguera de Campo Grande";MS;Privada;0;0;91;14.58;92;6.58;;;1;8;;
137;"Faculdade de Tecnologia de Valença (FACTIVA)";BA;Privada;;;92;14.57;93;6.57;;;1;8;;
138;"Faculdade Dom Luis de Orleans e Bragança (FARRP)";BA;Privada;;;93;14.53;95;6.53;;;1;8;;
139;"Universidade de Cuiabá (UNIC / PITÁGORAS)";MT;Privada;83;3.91;178;10.6;425;1.39;167;1.21;1;8;;
139;"Faculdade Brasileira (MULTIVIX)";ES;Privada;;;94;14.51;98;6.49;45;3.26;208;4.76;;
141;"Faculdade Dom Pedro Ii de Tecnologia (FAB)";BA;Privada;;;95;14.5;97;6.5;;;1;8;;
142;"Faculdade Anhangüera de Ribeirão Preto";SP;Privada;;;96;14.43;102;6.43;;;1;8;;
143;"Faculdade Anhangüera de Piracicaba";SP;Privada;;;97;14.35;107;6.35;;;1;8;;
144;"Centro Universitário Uniseb (UNISEB)";SP;Privada;0;0;98;14.22;65;7;68;2.87;234;4.35;;
145;"Faculdade do Sul (FACSUL)";BA;Privada;;;99;14.21;116;6.21;;;1;8;;
146;"Instituto Federal de Educação, Ciência e Tecnologia do Ceará (IFCE)";CE;Pública;;;100;14.16;119;6.16;;;1;8;;
147;"Faculdade Doctum de Juiz de Fora (DOCTUM)";MG;Privada;0;0;101;14.07;125;6.07;;;1;8;;
148;"Faculdade Anhanguera de Educação, Ciências e Tecnologia de Sorocaba (FAECTS)";SP;Privada;;;104;13.77;144;5.77;;;1;8;;
149;"Faculdade Figueiredo Costa (FIC)";AL;Privada;;;105;13.72;147;5.72;;;1;8;;
150;"Faculdade de Ciências Sociais e Humanas Sobral Pinto (FAIESP)";MT;Privada;;;106;13.68;150;5.68;;;1;8;;
151;"Universidade Católica Dom Bosco (UCDB)";MS;Privada;83;3.91;219;9.67;219;4.6;;;188;5.07;;
152;"Faculdades Integradas de Bauru (FIB)";SP;Privada;;;108;13.4;168;5.4;;;1;8;;
153;"Universidade do Estado de Mato Grosso (UNEMAT)";MT;Pública;;;110;13.38;362;2.37;60;3.01;1;8;;
154;"Faculdade Araguaia (FARA)";GO;Privada;;;111;13.35;171;5.35;;;1;8;;
155;"Faculdade Metropolitana da Amazônia (FAMAZ)";PA;Privada;;;112;13.22;179;5.22;;;1;8;;
156;"Centro Universitário Central Paulista (UNICEP)";SP;Privada;;;113;13.15;23;7.66;118;2.03;291;3.46;;
157;"Fundação Universidade do Estado de Santa Catarina (UDESC)";SC;Pública;0;0;114;13.11;137;5.88;13;3.8;293;3.43;0;0
158;"Faculdade Anhanguera de Pelotas";RS;Privada;;;115;13.04;191;5.04;;;1;8;;
159;"Faculdade de Ensino Superior do Interior Paulista (FAIP)";SP;Privada;;;116;13.02;192;5.02;;;1;8;;
160;"Centro Universitário de Volta Redonda (UNIFOA)";RJ;Privada;0;0;117;12.98;57;7.13;222;0.29;157;5.56;0;0
161;"Faculdade Meridional (IMED)";RS;Privada;;;119;12.89;14;7.8;;;187;5.09;;
162;"Faculdade Anhangüera de Campinas";SP;Privada;;;120;12.87;202;4.87;;;1;8;;
163;"Instituto Federal de Educação, Ciência e Tecnologia Goiano (IF Goiano)";GO;Pública;;;121;12.73;28;7.58;;;183;5.15;;
164;"Faculdade Aldete Maria Alves (FAMA)";MG;Privada;;;122;12.59;45;7.31;;;175;5.28;;
165;"Faculdade Pitágoras de Maceió";AL;Privada;0;0;124;12.57;221;4.57;;;1;8;;
166;"Faculdade Capixaba de Nova Venécia (MULTIVIX)";ES;Privada;;;125;12.55;222;4.55;;;1;8;;
167;"Instituto Tecnológico de Caratinga (ITC)";MG;Privada;;;126;12.53;258;3.99;207;0.54;1;8;;
168;"Faculdades Integradas Rui Barbosa (FIRB)";SP;Privada;;;127;12.51;225;4.51;;;1;8;;
169;"Universidade do Vale do Itajaí (UNIVALI)";SC;Privada;;;129;12.43;229;4.44;75;2.76;178;5.23;;
170;"Centro Universitário Euro-Americano (UNIEURO)";DF;Privada;;;131;12.2;245;4.2;;;1;8;;
171;"Faculdade Pitágoras de Teixeira de Freitas (PIT TEIXEIRA)";BA;Privada;0;0;132;12.16;247;4.16;;;1;8;;
171;"Centro Universitário Luterano de Palmas (CEULP)";TO;Privada;0;0;132;12.16;155;5.6;195;0.74;140;5.82;;
173;"Faculdade Nossa Cidade (FNC)";SP;Privada;;;135;12.06;112;6.27;;;142;5.79;;
174;"Unidade de Ensino Superior Dom Bosco (UNDB)";MA;Privada;83;3.91;288;8.12;346;2.62;123;1.95;285;3.55;;
175;"Universidade Anhembi Morumbi (UAM)";SP;Privada;;;136;12.01;22;7.67;159;1.35;321;2.99;;
176;"Centro Universitário de Brasília (UNICEUB)";DF;Privada;83;3.91;290;8.08;169;5.38;98;2.37;491;0.33;0;0
177;"Instituto Federal de Educação, Ciência e Tecnologia do Tocantins (IFTO)";TO;Pública;;;137;11.93;262;3.93;;;1;8;;
178;"Faculdade Norte Capixaba de São Mateus (MULTIVIX)";ES;Privada;;;138;11.91;263;3.91;;;1;8;;
179;"Instituto Federal de Educação, Ciência e Tecnologia Sul-Rio-Grandense (IFSul)";RS;Pública;;;139;11.84;268;3.84;;;1;8;;
179;"Faculdade de Iporá (FAI)";GO;Privada;;;139;11.84;268;3.84;;;1;8;;
179;"Faculdade Paraíso do Ceará (FAP)";CE;Privada;;;139;11.84;268;3.84;;;1;8;;
182;"Universidade Luterana do Brasil (ULBRA)";RS;Privada;0;0;142;11.78;210;4.74;120;2;190;5.04;;
183;"Centro Universitário Anhanguera (UNIA)";SP;Privada;0;0;143;11.73;120;6.14;;;155;5.59;;
184;"Universidade Feevale (FEEVALE)";RS;Privada;;;144;11.72;122;6.11;;;154;5.61;;
185;"Faculdade de Ciências Jurídicas e Sociais Aplicadas de Primavera do Leste";MT;Privada;;;145;11.72;107;6.35;;;169;5.37;;
186;"Universidade de Taubaté (UNITAU)";SP;Pública;0;0;146;11.68;146;5.74;185;0.91;191;5.03;;
187;"Instituto Federal de Educação, Ciência e Tecnologia do Sul de Minas Gerais (IF SUL DE MINAS)";MG;Pública;;;147;11.62;282;3.62;;;1;8;;
188;"Centro Universitário Adventista de São Paulo (UNASP)";SP;Privada;;;148;11.61;129;6;96;2.4;307;3.21;;
189;"Universidade Vila Velha (UVV)";ES;Privada;0;0;149;11.55;174;5.3;14;3.78;354;2.47;;
189;"Universidade do Grande Rio Professor José de Souza Herdy (UNIGRANRIO)";RJ;Privada;;;149;11.55;139;5.85;;;148;5.7;;
191;"Faculdades Integradas Pitágoras (FIP-MOC)";MG;Privada;;;151;11.53;218;4.62;174;1.09;140;5.82;;
192;"Faculdade Metropolitana de Manaus (FAMETRO)";AM;Privada;0;0;153;11.42;100;6.46;;;195;4.96;;
193;"Universidade do Ceuma (UNICEUMA)";MA;Privada;0;0;157;11.24;306;3.24;;;1;8;;
194;"Centro Universitário Luterano de Manaus (CEULM/ULBRA)";AM;Privada;0;0;158;11.18;348;2.59;204;0.59;1;8;;
195;"Centro Universitário Planalto do Distrito Federal (UNIPLAN)";DF;Privada;;;159;11.17;184;5.15;199;0.67;170;5.35;;
196;"Universidade Católica de Santos (UNISANTOS)";SP;Privada;;;160;11.14;175;5.29;187;0.87;194;4.98;;
197;"Centro Universitário de Franca (UNI-FACEF)";SP;Pública;;;161;11.1;37;7.44;;;278;3.66;;
198;"Centro Universitário de Mineiros (UNIFIMES)";GO;Pública;;;162;11.07;317;3.07;;;1;8;;
199;"Centro Universitário Filadélfia (UNIFIL)";PR;Privada;0;0;164;11.06;253;4.07;4;3.95;318;3.04;;
200;"Universidade Anhanguera (UNIDERP)";MS;Privada;0;0;165;11.01;255;4.04;165;1.24;146;5.73;;
201;"Centro Universitário de Várzea Grande (UNIVAG)";MT;Privada;0;0;166;11.01;160;5.52;117;2.05;292;3.44;;
202;"Faculdades Unificadas de Teófilo Otoni (FUTO)";MG;Privada;;;167;11;361;2.39;203;0.61;1;8;;
203;"Faculdade de Rondônia (FARO)";RO;Privada;83;3.91;330;7.07;439;1.17;148;1.53;233;4.37;;
204;"Faculdades Integradas São Pedro (FAESA)";ES;Privada;0;0;168;10.94;260;3.96;25;3.6;296;3.38;;
205;"Faculdades Adamantinenses Integradas (FAI)";SP;Pública;;;169;10.94;96;6.52;;;230;4.42;;
206;"União das Faculdades dos Grandes Lagos (UNILAGO)";SP;Privada;;;170;10.86;166;5.43;;;165;5.43;;
207;"Universidade do Vale do Paraíba (UNIVAP)";SP;Privada;0;0;171;10.81;53;7.19;188;0.86;336;2.76;;
207;"Universidade de Uberaba (UNIUBE)";MG;Privada;83;3.91;343;6.9;422;1.44;149;1.51;260;3.95;;
209;"Instituto Federal de Educação, Ciência e Tecnologia de Goiás (IFG)";GO;Pública;;;172;10.79;335;2.79;;;1;8;;
210;"Universidade Católica de Pelotas (UCPEL)";RS;Privada;0;0;173;10.74;199;4.91;136;1.73;250;4.1;0;0
211;"Centro Universitário Unirg (UNIRG)";TO;Pública;;;174;10.73;339;2.73;;;1;8;;
212;"Universidade Ibirapuera (UNIB)";SP;Privada;;;175;10.72;134;5.93;;;206;4.79;;
213;"Centro Universitário de Belo Horizonte (UNI-BH)";MG;Privada;;;176;10.65;128;6.02;153;1.45;309;3.18;;
214;"Universidade Federal do Amapá (UNIFAP)";AP;Pública;;;177;10.64;345;2.64;;;1;8;;
215;"Faculdade Pitágoras de Londrina";PR;Privada;;;180;10.44;318;3.06;108;2.2;181;5.18;;
216;"Faculdades Integradas Einstein de Limeira (FIEL)";SP;Privada;0;0;182;10.36;331;2.85;133;1.78;146;5.73;;
217;"Faculdade Pitágoras de Jundiaí (PIT JUNDIAÍ)";SP;Privada;0;0;183;10.33;207;4.79;196;0.72;204;4.82;;
218;"Centro Universitário Católico Salesiano Auxilium (UNISALESIANO)";SP;Privada;;;184;10.32;170;5.37;;;196;4.95;;
219;"Faculdade Regional de Alagoinhas (FARAL)";BA;Privada;;;185;10.3;141;5.82;;;226;4.48;;
220;"Faculdade Doctum de João Monlevade (DOCTUM)";MG;Privada;;;186;10.28;368;2.28;;;1;8;;
221;"Centro Universitário Geraldo Di Biase (UGB)";RJ;Privada;;;187;10.21;143;5.79;183;0.94;290;3.48;;
222;"Centro Universitário Sant´Anna (UNISANT'ANNA)";SP;Privada;;;188;10.13;58;7.11;;;319;3.02;;
223;"Universidade de Ribeirão Preto (UNAERP)";SP;Privada;0;0;189;10.12;204;4.83;;;174;5.29;;
224;"Faculdade de Ciências Humanas e Sociais (FUCAMP)";MG;Privada;;;190;10.11;379;2.11;;;1;8;;
225;"Centro Universitário do Vale do Ipojuca (UNIVIP)";PE;Privada;;;191;10.1;235;4.35;85;2.59;310;3.16;;
226;"Universidade da Região de Joinville (UNIVILLE)";SC;Pública;;;192;10.06;131;5.97;;;251;4.09;;
227;"Faculdade Santa Rita (FASAR)";MG;Privada;;;193;10.05;185;5.13;;;198;4.92;;
228;"Faculdade Presidente Antônio Carlos (FAPAC)";TO;Privada;;;195;10.02;177;5.26;231;0.13;216;4.63;;
229;"Instituto Federal de Educação, Ciência e Tecnologia de Alagoas (IFAL)";AL;Pública;;;196;10.01;385;2.01;;;1;8;;
230;"Instituto Federal de Educação, Ciência e Tecnologia da Paraíba (IFPB)";PB;Pública;0;0;198;9.98;387;1.98;;;1;8;;
231;"Instituto de Ensino Superior do Acre (IESACRE)";AC;Privada;;;199;9.97;91;6.6;;;297;3.37;;
232;"Faculdade Unime de Ciências Exatas e Tecnológicas (FCT)";BA;Privada;;;200;9.95;389;1.95;;;1;8;;
233;"Centro Universitário de União da Vitória (UNIUV)";PR;Pública;;;201;9.92;459;0.86;176;1.06;1;8;;
234;"Faculdade de Guanambi";BA;Privada;;;202;9.89;393;1.89;;;1;8;;
235;"Faculdade de Filosofia e Ciências Humanas de Goiatuba (FAFICH)";GO;Pública;;;203;9.86;395;1.86;;;1;8;;
235;"Instituto Federal de Educação, Ciência e Tecnologia do Amazonas (IFAM)";AM;Pública;;;203;9.86;395;1.86;;;1;8;;
235;"Faculdade Católica Paulista (FACAP)";SP;Privada;;;203;9.86;395;1.86;;;1;8;;
235;"Faculdade Estácio de Sá de Campo Grande (FESCG)";MS;Privada;0;0;203;9.86;395;1.86;;;1;8;;
239;"Faculdade Metropolitana de Rio do Sul (FAMESUL)";SC;Privada;;;207;9.84;176;5.27;;;220;4.57;;
240;"Universidade Cruzeiro do Sul (UNICSUL)";SP;Privada;0;0;208;9.81;80;6.77;220;0.32;338;2.72;;
241;"Universidade Camilo Castelo Branco (UNICASTELO)";SP;Privada;0;0;209;9.79;251;4.1;116;2.07;281;3.62;;
242;"Faculdade Politécnica de Campinas (POLICAMP)";SP;Privada;;;212;9.74;242;4.24;;;161;5.5;;
243;"Faculdade de Ciências Sociais Aplicadas de Extrema (FAEX)";MG;Privada;;;214;9.74;163;5.47;;;239;4.27;;
244;"Faculdade Estácio de Sergipe (FASE)";SE;Privada;0;0;215;9.73;164;5.46;;;239;4.27;;
245;"Centro Universitário Univates (UNIVATES)";RS;Privada;0;0;217;9.71;299;3.35;88;2.54;268;3.82;;
246;"Faculdade do Vale do Itajaí Mirim (FAVIM)";SC;Privada;;;219;9.67;407;1.67;;;1;8;;
247;"Faculdade de Tecnologia Senai Cimatec (SENAI CIMATEC)";BA;Privada;;;221;9.62;211;4.73;;;200;4.89;;
248;"Faculdades Integradas do Brasil (FACBRASIL)";PR;Privada;;;222;9.61;158;5.55;;;253;4.06;;
249;"Centro Universitário de Lins (UNILINS)";SP;Privada;;;223;9.57;200;4.9;91;2.49;373;2.18;;
250;"Faculdade de Pato Branco (FADEP)";PR;Privada;;;224;9.53;416;1.53;;;1;8;;
251;"Faculdade Presidente Antônio Carlos de Teófilo Otoni (FUNEES Teófilo Otoni)";MG;Privada;;;225;9.5;446;1.06;213;0.44;1;8;;
